{
  "task_type": "compliance-enterprise",
  "task_family": "compliance",
  "downstream_agent": "sa-skills:compliance-generator",
  "required_sections": [
    {
      "file": "ARCHITECTURE.md"
    },
    {
      "file": "docs/01-system-overview.md"
    },
    {
      "file": "docs/02-architecture-principles.md"
    },
    {
      "file": "docs/03-architecture-layers.md"
    },
    {
      "file": "adr/README.md"
    }
  ],
  "optional_sections": [
    {
      "file": "docs/01-system-overview.md"
    },
    {
      "file": "adr/*.md",
      "anchor_hints": [
        "Strategic alignment",
        "Enterprise modularity",
        "Cloud-first approach",
        "Technology lifecycle management"
      ]
    },
    {
      "file": "docs/components/**/*.md"
    }
  ],
  "candidate_files": [
    "ARCHITECTURE.md",
    "docs/*.md",
    "docs/components/README.md",
    "docs/components/**/*.md",
    "adr/*.md"
  ],
  "relevance_keywords": {
    "boost": [
      {
        "term": "business capability",
        "weight": 3
      },
      {
        "term": "capability map",
        "weight": 3
      },
      {
        "term": "business alignment",
        "weight": 3
      },
      {
        "term": "business domain",
        "weight": 3
      },
      {
        "term": "modularity",
        "weight": 3
      },
      {
        "term": "bounded context",
        "weight": 3
      },
      {
        "term": "domain-driven",
        "weight": 3
      },
      {
        "term": "microservice",
        "weight": 3
      },
      {
        "term": "service boundary",
        "weight": 3
      },
      {
        "term": "third-party",
        "weight": 3
      },
      {
        "term": "COTS",
        "weight": 3
      },
      {
        "term": "vendor",
        "weight": 3
      },
      {
        "term": "customization",
        "weight": 3
      },
      {
        "term": "SaaS customization",
        "weight": 3
      },
      {
        "term": "cloud-first",
        "weight": 3
      },
      {
        "term": "cloud-native",
        "weight": 3
      },
      {
        "term": "cloud adoption",
        "weight": 3
      },
      {
        "term": "cloud strategy",
        "weight": 3
      },
      {
        "term": "technology lifecycle",
        "weight": 3
      },
      {
        "term": "EOL",
        "weight": 3
      },
      {
        "term": "end of life",
        "weight": 3
      },
      {
        "term": "technology age",
        "weight": 3
      },
      {
        "term": "obsolescence",
        "weight": 3
      },
      {
        "term": "API-first",
        "weight": 3
      },
      {
        "term": "API design",
        "weight": 3
      },
      {
        "term": "API strategy",
        "weight": 3
      },
      {
        "term": "RESTful",
        "weight": 3
      },
      {
        "term": "GraphQL",
        "weight": 3
      },
      {
        "term": "event-driven",
        "weight": 3
      },
      {
        "term": "event sourcing",
        "weight": 3
      }
    ],
    "negative": [
      "pricing",
      "marketing copy",
      "user research"
    ]
  },
  "gap_markers": [
    {
      "name": "missing_business_capability_alignment",
      "absent_pattern": "(business capability|capability map|business alignment|business domain)",
      "case_insensitive": true,
      "severity": "high"
    },
    {
      "name": "missing_modularity",
      "absent_pattern": "(modularity|bounded context|domain-driven|microservice|service boundary)",
      "case_insensitive": true,
      "severity": "high"
    },
    {
      "name": "missing_third_party_customization",
      "absent_pattern": "(third-party|COTS|vendor|customization|SaaS customization)",
      "case_insensitive": true,
      "severity": "high"
    },
    {
      "name": "missing_cloud_first",
      "absent_pattern": "(cloud-first|cloud-native|cloud adoption|cloud strategy)",
      "case_insensitive": true,
      "severity": "high"
    },
    {
      "name": "missing_technology_lifecycle",
      "absent_pattern": "(technology lifecycle|EOL|end of life|technology age|obsolescence)",
      "case_insensitive": true,
      "severity": "high"
    },
    {
      "name": "missing_api_first",
      "absent_pattern": "(API-first|API design|API strategy|RESTful|GraphQL)",
      "case_insensitive": true,
      "severity": "high"
    }
  ],
  "score_threshold": 0.3,
  "output_format": "v1",
  "notes": "Auto-derived from agents/configs/enterprise.json. Boost terms extracted from phase3.data_points patterns + key_data_points. Gap markers project blocker-tier data_points to absent_pattern checks. Hand-tune via --force after editing this file directly."
}
