{
  "task_type": "compliance-platform",
  "task_family": "compliance",
  "downstream_agent": "sa-skills:compliance-generator",
  "required_sections": [
    {
      "file": "ARCHITECTURE.md"
    },
    {
      "file": "docs/03-architecture-layers.md"
    },
    {
      "file": "docs/06-technology-stack.md"
    },
    {
      "file": "docs/09-operational-considerations.md"
    },
    {
      "file": "docs/08-scalability-and-performance.md"
    }
  ],
  "optional_sections": [
    {
      "file": "docs/01-system-overview.md"
    },
    {
      "file": "adr/*.md",
      "anchor_hints": [
        "Platform design and deployment",
        "Infrastructure standards",
        "Capacity planning",
        "Resource naming conventions"
      ]
    },
    {
      "file": "docs/components/**/*.md"
    }
  ],
  "candidate_files": [
    "ARCHITECTURE.md",
    "docs/*.md",
    "docs/components/README.md",
    "docs/components/**/*.md",
    "adr/*.md"
  ],
  "relevance_keywords": {
    "boost": [
      {
        "term": "environment isolation",
        "weight": 3
      },
      {
        "term": "production environment",
        "weight": 3
      },
      {
        "term": "staging",
        "weight": 3
      },
      {
        "term": "development",
        "weight": 3
      },
      {
        "term": "network isolation",
        "weight": 3
      },
      {
        "term": "operating system",
        "weight": 3
      },
      {
        "term": "Linux",
        "weight": 3
      },
      {
        "term": "Windows Server",
        "weight": 3
      },
      {
        "term": "Ubuntu",
        "weight": 3
      },
      {
        "term": "RHEL",
        "weight": 3
      },
      {
        "term": "CentOS",
        "weight": 3
      },
      {
        "term": "database",
        "weight": 3
      },
      {
        "term": "PostgreSQL",
        "weight": 3
      },
      {
        "term": "MySQL",
        "weight": 3
      },
      {
        "term": "MongoDB",
        "weight": 3
      },
      {
        "term": "SQL Server",
        "weight": 3
      },
      {
        "term": "Oracle",
        "weight": 3
      },
      {
        "term": "database capacity",
        "weight": 3
      },
      {
        "term": "retention policy",
        "weight": 3
      },
      {
        "term": "data retention",
        "weight": 3
      },
      {
        "term": "backup retention",
        "weight": 3
      },
      {
        "term": "log retention",
        "weight": 3
      },
      {
        "term": "naming convention",
        "weight": 3
      },
      {
        "term": "naming standard",
        "weight": 3
      },
      {
        "term": "resource naming",
        "weight": 3
      },
      {
        "term": "nomenclature",
        "weight": 3
      },
      {
        "term": "capacity",
        "weight": 3
      },
      {
        "term": "TPS",
        "weight": 3
      },
      {
        "term": "transactions per second",
        "weight": 3
      },
      {
        "term": "throughput",
        "weight": 3
      }
    ],
    "negative": [
      "pricing",
      "marketing copy",
      "user research"
    ]
  },
  "gap_markers": [
    {
      "name": "missing_environment_isolation",
      "absent_pattern": "(environment isolation|production environment|staging|development|network isolation)",
      "case_insensitive": true,
      "severity": "high"
    },
    {
      "name": "missing_operating_systems",
      "absent_pattern": "(operating system|OS|Linux|Windows Server|Ubuntu|RHEL|CentOS)",
      "case_insensitive": true,
      "severity": "high"
    },
    {
      "name": "missing_database",
      "absent_pattern": "(database|PostgreSQL|MySQL|MongoDB|SQL Server|Oracle|database capacity)",
      "case_insensitive": true,
      "severity": "high"
    },
    {
      "name": "missing_retention_policies",
      "absent_pattern": "(retention policy|data retention|backup retention|log retention)",
      "case_insensitive": true,
      "severity": "high"
    },
    {
      "name": "missing_naming_conventions",
      "absent_pattern": "(naming convention|naming standard|resource naming|nomenclature)",
      "case_insensitive": true,
      "severity": "high"
    },
    {
      "name": "missing_capacity_planning",
      "absent_pattern": "(capacity|TPS|transactions per second|throughput|scalability|3x growth)",
      "case_insensitive": true,
      "severity": "high"
    }
  ],
  "score_threshold": 0.3,
  "output_format": "v1",
  "notes": "Auto-derived from agents/configs/platform.json. Boost terms extracted from phase3.data_points patterns + key_data_points. Gap markers project blocker-tier data_points to absent_pattern checks. Hand-tune via --force after editing this file directly."
}
