{
  "task_type": "peer-review-coherence",
  "task_family": "peer-review",
  "downstream_agent": "sa-skills:peer-review-category-agent",
  "required_sections": [
    {
      "file": "ARCHITECTURE.md"
    },
    {
      "file": "docs/01-system-overview.md"
    },
    {
      "file": "docs/03-architecture-layers.md"
    },
    {
      "file": "docs/04-data-flow-patterns.md"
    },
    {
      "file": "docs/05-integration-points.md"
    }
  ],
  "optional_sections": [
    {
      "file": "docs/components/**/*.md"
    },
    {
      "file": "adr/*.md"
    }
  ],
  "candidate_files": [
    "ARCHITECTURE.md",
    "docs/*.md",
    "docs/components/README.md",
    "docs/components/**/*.md",
    "adr/*.md"
  ],
  "relevance_keywords": {
    "boost": [
      {
        "term": "coherence",
        "weight": 4
      },
      {
        "term": "consistency",
        "weight": 4
      },
      {
        "term": "alignment",
        "weight": 3
      },
      {
        "term": "narrative",
        "weight": 2
      }
    ],
    "negative": []
  },
  "gap_markers": [],
  "score_threshold": 0.25,
  "output_format": "v1",
  "notes": "Auto-derived from skills/architecture-peer-review/PEER_REVIEW_CRITERIA.md category COHERENCE. Lower threshold (0.25) since peer-review categories overlap and broad inclusion is preferred."
}
