{
  "task_type": "analysis-stride",
  "task_family": "analysis",
  "downstream_agent": "sa-skills:architecture-analysis-agent",
  "required_sections": [
    {
      "file": "ARCHITECTURE.md"
    },
    {
      "file": "docs/07-security-architecture.md"
    },
    {
      "file": "docs/05-integration-points.md"
    },
    {
      "file": "docs/components/README.md"
    }
  ],
  "optional_sections": [
    {
      "file": "docs/01-system-overview.md"
    },
    {
      "file": "adr/*.md",
      "anchor_hints": [
        "Trust Boundary",
        "Authentication",
        "Authorization"
      ]
    },
    {
      "file": "docs/components/**/*.md",
      "anchor_hints": [
        "Trust Boundary",
        "Authentication",
        "Authorization"
      ]
    }
  ],
  "candidate_files": [
    "ARCHITECTURE.md",
    "docs/*.md",
    "docs/components/README.md",
    "docs/components/**/*.md",
    "adr/*.md"
  ],
  "relevance_keywords": {
    "boost": [
      {
        "term": "spoofing",
        "weight": 5
      },
      {
        "term": "tampering",
        "weight": 5
      },
      {
        "term": "repudiation",
        "weight": 4
      },
      {
        "term": "information disclosure",
        "weight": 5
      },
      {
        "term": "denial of service",
        "weight": 5
      },
      {
        "term": "elevation of privilege",
        "weight": 5
      },
      {
        "term": "trust boundary",
        "weight": 5
      },
      {
        "term": "threat model",
        "weight": 5
      },
      {
        "term": "attack surface",
        "weight": 4
      },
      {
        "term": "principal",
        "weight": 3
      }
    ],
    "negative": [
      "pricing",
      "marketing copy"
    ]
  },
  "gap_markers": [
    {
      "name": "no_trust_boundary",
      "absent_pattern": "trust boundary",
      "case_insensitive": true,
      "severity": "high"
    },
    {
      "name": "no_authn",
      "absent_pattern": "authentication|authn",
      "case_insensitive": true,
      "severity": "high"
    }
  ],
  "score_threshold": 0.3,
  "output_format": "v1",
  "notes": "Auto-derived from architecture-analysis spec for analysis-stride. Boost terms tuned per analysis vocabulary."
}
