{
  "task_type": "peer-review-metrics",
  "task_family": "peer-review",
  "downstream_agent": "sa-skills:peer-review-category-agent",
  "required_sections": [
    {
      "file": "ARCHITECTURE.md"
    },
    {
      "file": "docs/08-scalability-and-performance.md"
    },
    {
      "file": "docs/09-operational-considerations.md"
    }
  ],
  "optional_sections": [
    {
      "file": "docs/components/**/*.md"
    },
    {
      "file": "adr/*.md"
    }
  ],
  "candidate_files": [
    "ARCHITECTURE.md",
    "docs/*.md",
    "docs/components/README.md",
    "docs/components/**/*.md",
    "adr/*.md"
  ],
  "relevance_keywords": {
    "boost": [
      {
        "term": "TPS",
        "weight": 4
      },
      {
        "term": "latency",
        "weight": 4
      },
      {
        "term": "SLO",
        "weight": 5
      },
      {
        "term": "throughput",
        "weight": 4
      },
      {
        "term": "realistic",
        "weight": 2
      }
    ],
    "negative": []
  },
  "gap_markers": [],
  "score_threshold": 0.25,
  "output_format": "v1",
  "notes": "Auto-derived from skills/architecture-peer-review/PEER_REVIEW_CRITERIA.md category METRICS. Lower threshold (0.25) since peer-review categories overlap and broad inclusion is preferred."
}
