{
  "task_type": "analysis-blast-radius",
  "task_family": "analysis",
  "downstream_agent": "sa-skills:architecture-analysis-agent",
  "required_sections": [
    {
      "file": "ARCHITECTURE.md"
    },
    {
      "file": "docs/04-data-flow-patterns.md"
    },
    {
      "file": "docs/05-integration-points.md"
    },
    {
      "file": "docs/components/README.md"
    }
  ],
  "optional_sections": [
    {
      "file": "docs/01-system-overview.md"
    },
    {
      "file": "adr/*.md",
      "anchor_hints": [
        "Dependencies",
        "Consumers",
        "Downstream"
      ]
    },
    {
      "file": "docs/components/**/*.md",
      "anchor_hints": [
        "Dependencies",
        "Consumers",
        "Downstream"
      ]
    }
  ],
  "candidate_files": [
    "ARCHITECTURE.md",
    "docs/*.md",
    "docs/components/README.md",
    "docs/components/**/*.md",
    "adr/*.md"
  ],
  "relevance_keywords": {
    "boost": [
      {
        "term": "downstream",
        "weight": 4
      },
      {
        "term": "upstream",
        "weight": 4
      },
      {
        "term": "dependency",
        "weight": 3
      },
      {
        "term": "fan-out",
        "weight": 4
      },
      {
        "term": "bulkhead",
        "weight": 3
      },
      {
        "term": "isolation",
        "weight": 3
      },
      {
        "term": "timeout",
        "weight": 2
      },
      {
        "term": "retry",
        "weight": 2
      },
      {
        "term": "circuit breaker",
        "weight": 3
      }
    ],
    "negative": [
      "pricing",
      "marketing copy"
    ]
  },
  "gap_markers": [
    {
      "name": "no_dependencies_section",
      "absent_pattern": "Dependencies",
      "case_insensitive": true,
      "severity": "high"
    }
  ],
  "score_threshold": 0.3,
  "output_format": "v1",
  "notes": "Auto-derived from architecture-analysis spec for analysis-blast-radius. Boost terms tuned per analysis vocabulary."
}
