{
  "task_type": "compliance-cloud",
  "task_family": "compliance",
  "downstream_agent": "sa-skills:compliance-generator",
  "required_sections": [
    { "file": "ARCHITECTURE.md" },
    { "file": "docs/03-architecture-layers.md" },
    { "file": "docs/06-technology-stack.md" },
    { "file": "docs/09-operational-considerations.md" },
    { "file": "docs/components/README.md" }
  ],
  "optional_sections": [
    {
      "file": "docs/07-security-architecture.md",
      "anchor_hints": ["IAM", "VPC", "Network", "Cloud Security"]
    },
    {
      "file": "docs/08-scalability-and-performance.md",
      "anchor_hints": ["Auto-scaling", "Region", "Availability Zone", "Multi-region"]
    },
    {
      "file": "adr/*.md",
      "anchor_hints": ["cloud", "AWS", "Azure", "GCP", "multi-region", "Terraform"]
    },
    {
      "file": "docs/components/**/*.md",
      "anchor_hints": ["Deployment", "Cloud", "Region"]
    }
  ],
  "candidate_files": [
    "ARCHITECTURE.md",
    "docs/*.md",
    "docs/components/README.md",
    "docs/components/**/*.md",
    "adr/*.md"
  ],
  "relevance_keywords": {
    "boost": [
      { "term": "AWS", "weight": 4 },
      { "term": "Azure", "weight": 4 },
      { "term": "GCP", "weight": 4 },
      { "term": "Google Cloud", "weight": 3 },
      { "term": "IaaS", "weight": 3 },
      { "term": "PaaS", "weight": 3 },
      { "term": "SaaS", "weight": 2 },
      { "term": "multi-region", "weight": 5 },
      { "term": "multi-AZ", "weight": 4 },
      { "term": "availability zone", "weight": 3 },
      { "term": "cross-region", "weight": 4 },
      { "term": "Terraform", "weight": 5 },
      { "term": "CloudFormation", "weight": 4 },
      { "term": "Pulumi", "weight": 3 },
      { "term": "Bicep", "weight": 3 },
      { "term": "ARM template", "weight": 3 },
      { "term": "Infrastructure as Code", "weight": 4 },
      { "term": "IaC", "weight": 4 },
      { "term": "Lambda", "weight": 3 },
      { "term": "S3", "weight": 2 },
      { "term": "EKS", "weight": 3 },
      { "term": "AKS", "weight": 3 },
      { "term": "GKE", "weight": 3 },
      { "term": "ECS", "weight": 3 },
      { "term": "Cloud Run", "weight": 3 },
      { "term": "App Service", "weight": 2 },
      { "term": "API Gateway", "weight": 2 },
      { "term": "CloudFront", "weight": 2 },
      { "term": "CloudWatch", "weight": 3 },
      { "term": "Azure Monitor", "weight": 3 },
      { "term": "Stackdriver", "weight": 2 },
      { "term": "reserved instance", "weight": 3 },
      { "term": "spot instance", "weight": 3 },
      { "term": "auto-scaling", "weight": 4 },
      { "term": "right-sizing", "weight": 3 },
      { "term": "FinOps", "weight": 3 },
      { "term": "VPC", "weight": 3 },
      { "term": "subnet", "weight": 2 },
      { "term": "NAT gateway", "weight": 2 },
      { "term": "load balancer", "weight": 3 }
    ],
    "negative": ["business plan", "marketing copy", "user research notes"]
  },
  "gap_markers": [
    {
      "name": "missing_cloud_provider",
      "absent_pattern": "(AWS|Azure|GCP|Google Cloud|Amazon Web Services|Microsoft Azure)",
      "case_insensitive": true,
      "severity": "blocker"
    },
    {
      "name": "missing_iac",
      "absent_pattern": "(Terraform|CloudFormation|Pulumi|Bicep|ARM template|Infrastructure as Code|IaC)",
      "case_insensitive": true,
      "severity": "high"
    },
    {
      "name": "missing_multi_region",
      "absent_pattern": "(multi[- ]region|multi[- ]AZ|cross[- ]region|disaster recovery)",
      "case_insensitive": true,
      "severity": "high"
    },
    {
      "name": "missing_cost_optimization",
      "absent_pattern": "(reserved instance|spot instance|auto[- ]scaling|right[- ]sizing|cost optimization|FinOps)",
      "case_insensitive": true,
      "severity": "desired"
    },
    {
      "name": "single_region_anti_pattern",
      "present_pattern": "single[- ]region",
      "case_insensitive": true,
      "severity": "high"
    }
  ],
  "score_threshold": 0.3,
  "output_format": "v1",
  "notes": "Hand-tuned exemplar for Cloud compliance (LAC1-LAC6). Atlas persona — multi-region readiness, IaC coverage, cost discipline. Required sections cover deployment model, technology stack, operations, and component infrastructure. single_region_anti_pattern is a present-pattern marker — finding it triggers a high-severity gap reminding the team to design for multi-region from the start."
}
