{
  "task_type": "compliance-development",
  "task_family": "compliance",
  "downstream_agent": "sa-skills:compliance-generator",
  "required_sections": [
    {
      "file": "ARCHITECTURE.md"
    },
    {
      "file": "docs/02-architecture-principles.md"
    },
    {
      "file": "docs/components/README.md"
    },
    {
      "file": "docs/06-technology-stack.md"
    },
    {
      "file": "adr/README.md"
    },
    {
      "file": "docs/09-operational-considerations.md"
    }
  ],
  "optional_sections": [
    {
      "file": "docs/01-system-overview.md"
    },
    {
      "file": "adr/*.md",
      "anchor_hints": [
        "Software development standards",
        "Technical debt management",
        "Code quality",
        "Technology lifecycle"
      ]
    },
    {
      "file": "docs/components/**/*.md"
    }
  ],
  "candidate_files": [
    "ARCHITECTURE.md",
    "docs/*.md",
    "docs/components/README.md",
    "docs/components/**/*.md",
    "adr/*.md"
  ],
  "relevance_keywords": {
    "boost": [
      {
        "term": "language",
        "weight": 3
      },
      {
        "term": "framework",
        "weight": 3
      },
      {
        "term": "library",
        "weight": 3
      },
      {
        "term": "Java",
        "weight": 3
      },
      {
        "term": "Python",
        "weight": 3
      },
      {
        "term": "Node",
        "weight": 3
      },
      {
        "term": "React",
        "weight": 3
      },
      {
        "term": "Spring",
        "weight": 3
      },
      {
        "term": "code coverage",
        "weight": 3
      },
      {
        "term": "test coverage",
        "weight": 3
      },
      {
        "term": "unit test",
        "weight": 3
      },
      {
        "term": "integration test",
        "weight": 3
      },
      {
        "term": "technical debt",
        "weight": 3
      },
      {
        "term": "tech debt",
        "weight": 3
      },
      {
        "term": "refactoring",
        "weight": 3
      },
      {
        "term": "code quality",
        "weight": 3
      },
      {
        "term": "code smell",
        "weight": 3
      },
      {
        "term": "dependency",
        "weight": 3
      },
      {
        "term": "vulnerability",
        "weight": 3
      },
      {
        "term": "CVE",
        "weight": 3
      },
      {
        "term": "security patch",
        "weight": 3
      },
      {
        "term": "version upgrade",
        "weight": 3
      },
      {
        "term": "CI/CD",
        "weight": 3
      },
      {
        "term": "continuous integration",
        "weight": 3
      },
      {
        "term": "continuous deployment",
        "weight": 3
      },
      {
        "term": "Jenkins",
        "weight": 3
      },
      {
        "term": "GitHub Actions",
        "weight": 3
      },
      {
        "term": "GitLab CI",
        "weight": 3
      },
      {
        "term": "code review",
        "weight": 3
      },
      {
        "term": "peer review",
        "weight": 3
      }
    ],
    "negative": [
      "pricing",
      "marketing copy",
      "user research"
    ]
  },
  "gap_markers": [
    {
      "name": "missing_technology_stack",
      "absent_pattern": "(language|framework|library|Java|Python|Node|React|Spring|.NET)",
      "case_insensitive": true,
      "severity": "high"
    },
    {
      "name": "missing_code_coverage",
      "absent_pattern": "(code coverage|test coverage|unit test|integration test)",
      "case_insensitive": true,
      "severity": "high"
    },
    {
      "name": "missing_technical_debt",
      "absent_pattern": "(technical debt|tech debt|refactoring|code quality|code smell)",
      "case_insensitive": true,
      "severity": "high"
    },
    {
      "name": "missing_dependency_management",
      "absent_pattern": "(dependency|vulnerability|CVE|security patch|version upgrade)",
      "case_insensitive": true,
      "severity": "high"
    },
    {
      "name": "missing_ci_cd_pipeline",
      "absent_pattern": "(CI/CD|continuous integration|continuous deployment|Jenkins|GitHub Actions|GitLab CI)",
      "case_insensitive": true,
      "severity": "high"
    },
    {
      "name": "missing_code_review",
      "absent_pattern": "(code review|peer review|pull request|PR review)",
      "case_insensitive": true,
      "severity": "high"
    }
  ],
  "score_threshold": 0.3,
  "output_format": "v1",
  "notes": "Auto-derived from agents/configs/dev.json. Boost terms extracted from phase3.data_points patterns + key_data_points. Gap markers project blocker-tier data_points to absent_pattern checks. Hand-tune via --force after editing this file directly."
}
